{
  "artifacts": {
    "results": "results/phase6/RES-BB-RD-008Q/results.json",
    "summary_figure": "results/phase6/RES-BB-RD-008Q/predictive_summary.png",
    "summary_report": "results/phase6/RES-BB-RD-008Q/SUMMARY.md",
    "summary_table": "results/phase6/RES-BB-RD-008Q/split_summary.csv"
  },
  "code_hash": "eb69935590722b2194ce035d8ff074b974d392eae26a87d95376cac240202a48",
  "config_hash": "ecde80b6ce4e8cefb107aa24248d759eb44169bb373ee7676b484bb775f07e1d",
  "coordinate_metadata": {
    "all_holdouts_in_support": true,
    "extrapolation_policy": "error",
    "fitted_support": [
      9764513.0,
      19943695.0
    ],
    "prediction_axis": "CpG-genomic-coordinate",
    "reference_axis": "original-CpG-index",
    "reference_type": "model-derived-full-data-map"
  },
  "data_hash": "822cd6e347fa777308e9bb6b9e398a6499f1aa16cc2e7340ad0d0884119c40fb",
  "environment_hash": "b95226ebfc54f25622adeca577cc274a77d4c595aebf47782c99fadbc72217f7",
  "execution_status": "executed",
  "lineage_status": "corrected",
  "metrics": {
    "boundary_stability_f1_tau3": {
      "ci95_lower": 0.8102296272170277,
      "ci95_upper": 0.9469132299258292,
      "max": 1.0,
      "mean": 0.8785714285714284,
      "min": 0.7142857142857143,
      "standard_error": 0.03021089890583219
    },
    "calibration_status": "not-computed: BayesBreakBetaObs has no certified PIT CDF helper; no calibration statistic is defined for this execution",
    "captured_warnings": [
      {
        "category": "RuntimeWarning",
        "line": 243,
        "message": "overflow encountered in exp",
        "source": "beta_obs.py"
      }
    ],
    "elapsed_wall_seconds": 32.841877957980614,
    "full_data_reference": {
      "boundaries_original_index": [
        55,
        130,
        131,
        683,
        930,
        1159,
        1187,
        1333,
        1410,
        1468,
        1480,
        1629,
        1658,
        1851
      ],
      "fit_wall_seconds": 3.327595459006261,
      "k_map": 15,
      "log_evidence": -9518.667508691198
    },
    "interpretation_limit": "Scores are pointwise Beta-observation log predictive densities over ten predeclared in-support chromosome blocks with observed coverage as phi_new. Blocks are regions of one chromosome, not independent biological samples; no certified PIT calibration or external biological truth is reported.",
    "k_map": {
      "ci95_lower": 15.0,
      "ci95_upper": 15.0,
      "max": 15.0,
      "mean": 15.0,
      "min": 15.0,
      "standard_error": 0.0
    },
    "n_splits": 10,
    "observation_family": "beta-observation",
    "peak_rss": {
      "units": "bytes",
      "value": 376193024
    },
    "pooled_mean_log_predictive": -15.530049284146067,
    "protocol_id": "EPR-BB-012",
    "split_mean_log_predictive": {
      "ci95_lower": -23.14445740336607,
      "ci95_upper": -7.915641164926059,
      "max": -0.610696052740196,
      "mean": -15.530049284146065,
      "min": -28.881281720527767,
      "standard_error": 3.3659943015635854
    },
    "split_rows": [
      {
        "boundary_stability_f1_tau3": 0.7857142857142857,
        "boundary_stability_mae_tau3": 0.09090909090909091,
        "fit_wall_seconds": 2.914563999976963,
        "k_map": 15,
        "mean_log_predictive": -19.885207756327198,
        "n_test": 152,
        "n_train": 1752,
        "phi_new_max": 818.0,
        "phi_new_min": 10.0,
        "score_wall_seconds": 0.0011726249940693378,
        "seed": 261201,
        "split": 1,
        "test_start_index": 28,
        "test_stop_index_exclusive": 180,
        "total_log_predictive": -3022.551578961734
      },
      {
        "boundary_stability_f1_tau3": 0.7857142857142857,
        "boundary_stability_mae_tau3": 0.09090909090909091,
        "fit_wall_seconds": 2.911386666004546,
        "k_map": 15,
        "mean_log_predictive": -17.586917146529625,
        "n_test": 152,
        "n_train": 1752,
        "phi_new_max": 522.0,
        "phi_new_min": 10.0,
        "score_wall_seconds": 0.0011949170148000121,
        "seed": 261202,
        "split": 2,
        "test_start_index": 202,
        "test_stop_index_exclusive": 354,
        "total_log_predictive": -2673.211406272503
      },
      {
        "boundary_stability_f1_tau3": 1.0,
        "boundary_stability_mae_tau3": 0.0,
        "fit_wall_seconds": 2.895983874972444,
        "k_map": 15,
        "mean_log_predictive": -4.707656797183815,
        "n_test": 152,
        "n_train": 1752,
        "phi_new_max": 107.0,
        "phi_new_min": 10.0,
        "score_wall_seconds": 0.0009173330035991967,
        "seed": 261203,
        "split": 3,
        "test_start_index": 382,
        "test_stop_index_exclusive": 534,
        "total_log_predictive": -715.5638331719399
      },
      {
        "boundary_stability_f1_tau3": 0.9285714285714286,
        "boundary_stability_mae_tau3": 0.0,
        "fit_wall_seconds": 2.9306964579736814,
        "k_map": 15,
        "mean_log_predictive": -9.051874452907459,
        "n_test": 152,
        "n_train": 1752,
        "phi_new_max": 125.0,
        "phi_new_min": 10.0,
        "score_wall_seconds": 0.0009232499869540334,
        "seed": 261204,
        "split": 4,
        "test_start_index": 586,
        "test_stop_index_exclusive": 738,
        "total_log_predictive": -1375.8849168419338
      },
      {
        "boundary_stability_f1_tau3": 0.9285714285714286,
        "boundary_stability_mae_tau3": 0.0,
        "fit_wall_seconds": 2.920098041999154,
        "k_map": 15,
        "mean_log_predictive": -25.056580580504274,
        "n_test": 152,
        "n_train": 1752,
        "phi_new_max": 238.0,
        "phi_new_min": 10.0,
        "score_wall_seconds": 0.0008369170245714486,
        "seed": 261205,
        "split": 5,
        "test_start_index": 790,
        "test_stop_index_exclusive": 942,
        "total_log_predictive": -3808.60024823665
      },
      {
        "boundary_stability_f1_tau3": 1.0,
        "boundary_stability_mae_tau3": 0.0,
        "fit_wall_seconds": 2.902603666007053,
        "k_map": 15,
        "mean_log_predictive": -0.610696052740196,
        "n_test": 152,
        "n_train": 1752,
        "phi_new_max": 178.0,
        "phi_new_min": 10.0,
        "score_wall_seconds": 0.0007323329919017851,
        "seed": 261206,
        "split": 6,
        "test_start_index": 966,
        "test_stop_index_exclusive": 1118,
        "total_log_predictive": -92.82580001650979
      },
      {
        "boundary_stability_f1_tau3": 0.8571428571428571,
        "boundary_stability_mae_tau3": 0.08333333333333333,
        "fit_wall_seconds": 2.9464163330267183,
        "k_map": 15,
        "mean_log_predictive": -2.174969274778922,
        "n_test": 152,
        "n_train": 1752,
        "phi_new_max": 179.0,
        "phi_new_min": 12.0,
        "score_wall_seconds": 0.0009247080306522548,
        "seed": 261207,
        "split": 7,
        "test_start_index": 1171,
        "test_stop_index_exclusive": 1323,
        "total_log_predictive": -330.59532976639616
      },
      {
        "boundary_stability_f1_tau3": 0.7142857142857143,
        "boundary_stability_mae_tau3": 0.1,
        "fit_wall_seconds": 2.9575546660344116,
        "k_map": 15,
        "mean_log_predictive": -28.881281720527767,
        "n_test": 152,
        "n_train": 1752,
        "phi_new_max": 235.0,
        "phi_new_min": 10.0,
        "score_wall_seconds": 0.0008925420115701854,
        "seed": 261208,
        "split": 8,
        "test_start_index": 1341,
        "test_stop_index_exclusive": 1493,
        "total_log_predictive": -4389.95482152022
      },
      {
        "boundary_stability_f1_tau3": 0.8571428571428571,
        "boundary_stability_mae_tau3": 0.08333333333333333,
        "fit_wall_seconds": 3.1371157499961555,
        "k_map": 15,
        "mean_log_predictive": -19.498685253777893,
        "n_test": 152,
        "n_train": 1752,
        "phi_new_max": 290.0,
        "phi_new_min": 10.0,
        "score_wall_seconds": 0.0008479589596390724,
        "seed": 261209,
        "split": 9,
        "test_start_index": 1545,
        "test_stop_index_exclusive": 1697,
        "total_log_predictive": -2963.8001585742395
      },
      {
        "boundary_stability_f1_tau3": 0.9285714285714286,
        "boundary_stability_mae_tau3": 0.0,
        "fit_wall_seconds": 2.945409916981589,
        "k_map": 15,
        "mean_log_predictive": -27.846623806183526,
        "n_test": 152,
        "n_train": 1752,
        "phi_new_max": 160.0,
        "phi_new_min": 10.0,
        "score_wall_seconds": 0.0007757500279694796,
        "seed": 261210,
        "split": 10,
        "test_start_index": 1743,
        "test_stop_index_exclusive": 1895,
        "total_log_predictive": -4232.686818539896
      }
    ],
    "total_denominator": 1520,
    "total_log_predictive": -23605.67491190202
  },
  "output_hashes": {
    "results": "82cb81dc063a93f7e93c24a169a2a90dcf9291afc999e40e5f8a6b5e589bcb0b",
    "summary_figure": "fb132d9ee3df3f021c62d4bf5e9b76ecd6482c47629c5d270a79ebf1ac4e406f",
    "summary_report": "dcef0a674b9213de2539b3aec4e426b670a5b4b134d39c04b8d89935a80dcb6e",
    "summary_table": "2f809a8f03bc02f3c2b0b79370b4fc6dc0a910f7b91412d10bfff53708e915bc"
  },
  "parent_result_id": "RES-BB-RD-007Q",
  "result_id": "RES-BB-RD-008Q",
  "schema_version": "1.0.0",
  "scientific_interpretation": "valid-for-stated-interpretation",
  "split_hash": "76c7f52af33b45e9d9385fe368bfe0d621e93bdde89ae4a9cfe494918e8a1941",
  "weights_hash": "0237720765d5ff3b7e2364f32def43f454cc41ca3acaff3e6aa2177c310c775c"
}
